Matchday#, Team_Against, Home_Away, Match_Result, Word, TF-IDF
01, セレッソ大阪, Away, Draw, 公式, 0.056
01, セレッソ大阪, Away, Draw, ＡＣＬ, 0.041
01, セレッソ大阪, Away, Draw, すでに, 0.041
01, セレッソ大阪, Away, Draw, 長い, 0.041
01, セレッソ大阪, Away, Draw, ゼロックススーパーカップ, 0.041
01, セレッソ大阪, Away, Draw, に対し, 0.041
01, セレッソ大阪, Away, Draw, 戦, 0.034
01, セレッソ大阪, Away, Draw, 想定, 0.033
01, セレッソ大阪, Away, Draw, 初, 0.033
01, セレッソ大阪, Away, Draw, こなし, 0.033
02, 柏レイソル, Away, Lose, スタイル, 0.019
02, 柏レイソル, Away, Lose, もっと, 0.015
02, 柏レイソル, Away, Lose, かかる, 0.014
02, 柏レイソル, Away, Lose, まだまだ, 0.011
02, 柏レイソル, Away, Lose, 結びつき, 0.01
02, 柏レイソル, Away, Lose, 高める, 0.01
02, 柏レイソル, Away, Lose, レイソル, 0.01
02, 柏レイソル, Away, Lose, フィールド, 0.01
02, 柏レイソル, Away, Lose, 合わせ, 0.01
02, 柏レイソル, Away, Lose, 築い, 0.01
03, サガン鳥栖, Home, Lose, リスク, 0.021
03, サガン鳥栖, Home, Lose, 毎週, 0.018
03, サガン鳥栖, Home, Lose, 高く, 0.018
03, サガン鳥栖, Home, Lose, スタイル, 0.016
03, サガン鳥栖, Home, Lose, 太, 0.014
03, サガン鳥栖, Home, Lose, 阻止, 0.014
03, サガン鳥栖, Home, Lose, 渓, 0.014
03, サガン鳥栖, Home, Lose, リアクション, 0.014
03, サガン鳥栖, Home, Lose, 特に, 0.012
03, サガン鳥栖, Home, Lose, 良く, 0.011
04, 浦和レッズ, Away, Win, こだわっ, 0.01
04, 浦和レッズ, Away, Win, ボランチ, 0.01
04, 浦和レッズ, Away, Win, 貢献, 0.01
04, 浦和レッズ, Away, Win, ポジション, 0.01
04, 浦和レッズ, Away, Win, 分間, 0.008
04, 浦和レッズ, Away, Win, ９, 0.008
04, 浦和レッズ, Away, Win, フォーメーション, 0.008
04, 浦和レッズ, Away, Win, として, 0.008
04, 浦和レッズ, Away, Win, くる, 0.007
04, 浦和レッズ, Away, Win, 監督, 0.007
05, 清水エスパルス, Away, Win, 大津, 0.03
05, 清水エスパルス, Away, Win, 交代, 0.022
05, 清水エスパルス, Away, Win, ブマル, 0.018
05, 清水エスパルス, Away, Win, 若く, 0.015
05, 清水エスパルス, Away, Win, 引い, 0.015
05, 清水エスパルス, Away, Win, いきなり, 0.015
05, 清水エスパルス, Away, Win, 低く, 0.015
05, 清水エスパルス, Away, Win, 海, 0.015
05, 清水エスパルス, Away, Win, クリア, 0.015
05, 清水エスパルス, Away, Win, どおり, 0.015
06, 川崎フロンターレ, Home, Draw, ハーフタイム, 0.015
06, 川崎フロンターレ, Home, Draw, 任せる, 0.013
06, 川崎フロンターレ, Home, Draw, 運, 0.013
06, 川崎フロンターレ, Home, Draw, 過程, 0.01
06, 川崎フロンターレ, Home, Draw, ポジショニング, 0.01
06, 川崎フロンターレ, Home, Draw, 前半, 0.01
06, 川崎フロンターレ, Home, Draw, 成長, 0.009
06, 川崎フロンターレ, Home, Draw, 一番, 0.009
06, 川崎フロンターレ, Home, Draw, 修正, 0.009
06, 川崎フロンターレ, Home, Draw, 決める, 0.007
07, サンフレッチェ広島, Away, Lose, オープン, 0.035
07, サンフレッチェ広島, Away, Lose, 帯, 0.019
07, サンフレッチェ広島, Away, Lose, 敗れ, 0.017
07, サンフレッチェ広島, Away, Lose, そうなると, 0.017
07, サンフレッチェ広島, Away, Lose, 有利, 0.017
07, サンフレッチェ広島, Away, Lose, どり, 0.017
07, サンフレッチェ広島, Away, Lose, ただし, 0.017
07, サンフレッチェ広島, Away, Lose, 反応, 0.017
07, サンフレッチェ広島, Away, Lose, しまい, 0.017
07, サンフレッチェ広島, Away, Lose, 展開, 0.016
08, ヴィッセル神戸, Home, Lose, 解決, 0.026
08, ヴィッセル神戸, Home, Lose, 策, 0.021
08, ヴィッセル神戸, Home, Lose, くる, 0.018
08, ヴィッセル神戸, Home, Lose, つくっ, 0.012
08, ヴィッセル神戸, Home, Lose, 展開, 0.012
08, ヴィッセル神戸, Home, Lose, 続け, 0.012
08, ヴィッセル神戸, Home, Lose, いく, 0.011
08, ヴィッセル神戸, Home, Lose, 責任, 0.009
08, ヴィッセル神戸, Home, Lose, に関して, 0.009
08, ヴィッセル神戸, Home, Lose, 不安, 0.009
09, 湘南ベルマーレ, Home, Draw, ケガ, 0.024
09, 湘南ベルマーレ, Home, Draw, ミス, 0.024
09, 湘南ベルマーレ, Home, Draw, を通して, 0.016
09, 湘南ベルマーレ, Home, Draw, 走れ, 0.015
09, 湘南ベルマーレ, Home, Draw, 疲労, 0.015
09, 湘南ベルマーレ, Home, Draw, むしろ, 0.015
09, 湘南ベルマーレ, Home, Draw, ご覧, 0.015
09, 湘南ベルマーレ, Home, Draw, 負担, 0.015
09, 湘南ベルマーレ, Home, Draw, 個人, 0.015
09, 湘南ベルマーレ, Home, Draw, 仕留め, 0.015
10, 北海道コンサドーレ札幌, Away, Lose, 全く, 0.021
10, 北海道コンサドーレ札幌, Away, Lose, とか, 0.019
10, 北海道コンサドーレ札幌, Away, Lose, にとって, 0.016
10, 北海道コンサドーレ札幌, Away, Lose, つもり, 0.015
10, 北海道コンサドーレ札幌, Away, Lose, 変える, 0.015
10, 北海道コンサドーレ札幌, Away, Lose, 落ち, 0.011
10, 北海道コンサドーレ札幌, Away, Lose, 危険, 0.011
10, 北海道コンサドーレ札幌, Away, Lose, 迷わ, 0.011
10, 北海道コンサドーレ札幌, Away, Lose, オウンゴール, 0.011
10, 北海道コンサドーレ札幌, Away, Lose, 全力, 0.011
11, 鹿島アントラーズ, Home, Win, 多かっ, 0.018
11, 鹿島アントラーズ, Home, Win, ポジショニング, 0.018
11, 鹿島アントラーズ, Home, Win, 回数, 0.015
11, 鹿島アントラーズ, Home, Win, 仕事, 0.015
11, 鹿島アントラーズ, Home, Win, トップ, 0.015
11, 鹿島アントラーズ, Home, Win, コントロール, 0.012
11, 鹿島アントラーズ, Home, Win, 役割, 0.012
11, 鹿島アントラーズ, Home, Win, もっと, 0.011
11, 鹿島アントラーズ, Home, Win, サイド, 0.011
11, 鹿島アントラーズ, Home, Win, ロング, 0.01
12, ジュビロ磐田, Home, Lose, メンタル, 0.026
12, ジュビロ磐田, Home, Lose, いか, 0.019
12, ジュビロ磐田, Home, Lose, 受け入れ, 0.017
12, ジュビロ磐田, Home, Lose, 気持ち, 0.014
12, ジュビロ磐田, Home, Lose, パフォーマンス, 0.012
12, ジュビロ磐田, Home, Lose, まず, 0.012
12, ジュビロ磐田, Home, Lose, 直し, 0.011
12, ジュビロ磐田, Home, Lose, たい, 0.009
12, ジュビロ磐田, Home, Lose, 責任, 0.009
12, ジュビロ磐田, Home, Lose, 勝つ, 0.009
13, 名古屋グランパス, Away, Draw, しかし, 0.038
13, 名古屋グランパス, Away, Draw, かけ, 0.031
13, 名古屋グランパス, Away, Draw, ５, 0.027
13, 名古屋グランパス, Away, Draw, 同点, 0.027
13, 名古屋グランパス, Away, Draw, ああ, 0.027
13, 名古屋グランパス, Away, Draw, ４, 0.025
13, 名古屋グランパス, Away, Draw, プレッシャー, 0.024
13, 名古屋グランパス, Away, Draw, ゲーム, 0.023
13, 名古屋グランパス, Away, Draw, 分間, 0.021
13, 名古屋グランパス, Away, Draw, 見る, 0.021
14, ガンバ大阪, Home, Draw, 見る, 0.018
14, ガンバ大阪, Home, Draw, だけ, 0.012
14, ガンバ大阪, Home, Draw, 分間, 0.012
14, ガンバ大阪, Home, Draw, ９, 0.012
14, ガンバ大阪, Home, Draw, フィニッシュ, 0.011
14, ガンバ大阪, Home, Draw, 指摘, 0.011
14, ガンバ大阪, Home, Draw, 攻撃, 0.009
14, ガンバ大阪, Home, Draw, 乗り越え, 0.009
14, ガンバ大阪, Home, Draw, もう, 0.009
14, ガンバ大阪, Home, Draw, 思う, 0.007
15, Ｖ･ファーレン長崎, Home, Win, ワールドカップ, 0.015
15, Ｖ･ファーレン長崎, Home, Win, 期間, 0.015
15, Ｖ･ファーレン長崎, Home, Win, 理解, 0.013
15, Ｖ･ファーレン長崎, Home, Win, 差, 0.013
15, Ｖ･ファーレン長崎, Home, Win, にとって, 0.013
15, Ｖ･ファーレン長崎, Home, Win, シーズン, 0.011
15, Ｖ･ファーレン長崎, Home, Win, 悪い, 0.01
15, Ｖ･ファーレン長崎, Home, Win, 圧倒, 0.01
15, Ｖ･ファーレン長崎, Home, Win, 見せ, 0.01
15, Ｖ･ファーレン長崎, Home, Win, 良い, 0.01
16, ベガルタ仙台, Away, Win, 結びつい, 0.056
16, ベガルタ仙台, Away, Win, ８, 0.045
16, ベガルタ仙台, Away, Win, 中断, 0.045
16, ベガルタ仙台, Away, Win, 期間, 0.045
16, ベガルタ仙台, Away, Win, 準備, 0.022
16, ベガルタ仙台, Away, Win, 細かい, 0.022
16, ベガルタ仙台, Away, Win, ワールドカップ, 0.022
16, ベガルタ仙台, Away, Win, 誇らしく, 0.019
16, ベガルタ仙台, Away, Win, 結果, 0.017
16, ベガルタ仙台, Away, Win, 直し, 0.017
17, FC東京, Away, Lose, ＦＣ, 0.017
17, FC東京, Away, Lose, 守っ, 0.014
17, FC東京, Away, Lose, 悪い, 0.014
17, FC東京, Away, Lose, ・, 0.012
17, FC東京, Away, Lose, 誇らしく, 0.012
17, FC東京, Away, Lose, 展開, 0.011
17, FC東京, Away, Lose, 動き, 0.01
17, FC東京, Away, Lose, カウンター, 0.009
17, FC東京, Away, Lose, いる, 0.009
17, FC東京, Away, Lose, 戻ら, 0.008
18, 清水エスパルス, Home, Lose, なぜ, 0.02
18, 清水エスパルス, Home, Lose, ほめ, 0.017
18, 清水エスパルス, Home, Lose, 納得, 0.017
18, 清水エスパルス, Home, Lose, やはり, 0.015
18, 清水エスパルス, Home, Lose, １, 0.014
18, 清水エスパルス, Home, Lose, ね, 0.012
18, 清水エスパルス, Home, Lose, しまい, 0.012
18, 清水エスパルス, Home, Lose, かも, 0.01
18, 清水エスパルス, Home, Lose, あきらめ, 0.01
18, 清水エスパルス, Home, Lose, しれ, 0.009
19, サンフレッチェ広島, Home, Lose, 修正, 0.019
19, サンフレッチェ広島, Home, Lose, 期待, 0.017
19, サンフレッチェ広島, Home, Lose, 戦い, 0.014
19, サンフレッチェ広島, Home, Lose, いき, 0.01
19, サンフレッチェ広島, Home, Lose, 分間, 0.009
19, サンフレッチェ広島, Home, Lose, 責任, 0.009
19, サンフレッチェ広島, Home, Lose, 帯, 0.009
19, サンフレッチェ広島, Home, Lose, 次に, 0.008
19, サンフレッチェ広島, Home, Lose, ディフェンシブ, 0.008
19, サンフレッチェ広島, Home, Lose, 極め, 0.008
20, 川崎フロンターレ, Away, Lose, 成功, 0.02
20, 川崎フロンターレ, Away, Lose, 最終, 0.016
20, 川崎フロンターレ, Away, Lose, 無得点, 0.016
20, 川崎フロンターレ, Away, Lose, 決め, 0.013
20, 川崎フロンターレ, Away, Lose, 間違い, 0.012
20, 川崎フロンターレ, Away, Lose, 必ず, 0.011
20, 川崎フロンターレ, Away, Lose, 皆さん, 0.011
20, 川崎フロンターレ, Away, Lose, 始まっ, 0.01
20, 川崎フロンターレ, Away, Lose, ブレ, 0.01
20, 川崎フロンターレ, Away, Lose, その道, 0.01
21, 湘南ベルマーレ, Away, Win, 距離, 0.034
21, 湘南ベルマーレ, Away, Win, 帯, 0.019
21, 湘南ベルマーレ, Away, Win, 指示, 0.016
21, 湘南ベルマーレ, Away, Win, 安定, 0.014
21, 湘南ベルマーレ, Away, Win, すぎ, 0.014
21, 湘南ベルマーレ, Away, Win, 保つ, 0.014
21, 湘南ベルマーレ, Away, Win, 大きい, 0.014
21, 湘南ベルマーレ, Away, Win, プレッシャー, 0.012
21, 湘南ベルマーレ, Away, Win, 最初, 0.011
21, 湘南ベルマーレ, Away, Win, ロング, 0.009
22, 名古屋グランパス, Home, Lose, フォーメーション, 0.039
22, 名古屋グランパス, Home, Lose, 継続, 0.024
22, 名古屋グランパス, Home, Lose, 可能, 0.024
22, 名古屋グランパス, Home, Lose, シュート, 0.022
22, 名古屋グランパス, Home, Lose, バック, 0.017
22, 名古屋グランパス, Home, Lose, 使っ, 0.017
22, 名古屋グランパス, Home, Lose, クロス, 0.017
22, 名古屋グランパス, Home, Lose, 値する, 0.015
22, 名古屋グランパス, Home, Lose, べき, 0.015
22, 名古屋グランパス, Home, Lose, つくれ, 0.014
23, 鹿島アントラーズ, Away, Lose, 中澤, 0.035
23, 鹿島アントラーズ, Away, Lose, 思う, 0.029
23, 鹿島アントラーズ, Away, Lose, 外し, 0.028
23, 鹿島アントラーズ, Away, Lose, 伝え, 0.024
23, 鹿島アントラーズ, Away, Lose, 出し切っ, 0.024
23, 鹿島アントラーズ, Away, Lose, 誇らしく, 0.024
23, 鹿島アントラーズ, Away, Lose, 互角, 0.018
23, 鹿島アントラーズ, Away, Lose, タイト, 0.018
23, 鹿島アントラーズ, Away, Lose, 連続, 0.018
23, 鹿島アントラーズ, Away, Lose, ラスト, 0.018
24, ヴィッセル神戸, Away, Win, 若い, 0.028
24, ヴィッセル神戸, Away, Win, いける, 0.022
24, ヴィッセル神戸, Away, Win, 自身, 0.022
24, ヴィッセル神戸, Away, Win, ハード, 0.015
24, ヴィッセル神戸, Away, Win, ワーク, 0.015
24, ヴィッセル神戸, Away, Win, プレーヤー, 0.014
24, ヴィッセル神戸, Away, Win, 伸び, 0.014
24, ヴィッセル神戸, Away, Win, 大きな, 0.014
24, ヴィッセル神戸, Away, Win, 奪う, 0.014
24, ヴィッセル神戸, Away, Win, やめ, 0.014
25, 柏レイソル, Home, Win, 山中, 0.026
25, 柏レイソル, Home, Win, 表現, 0.019
25, 柏レイソル, Home, Win, バック, 0.018
25, 柏レイソル, Home, Win, 喜田, 0.01
25, 柏レイソル, Home, Win, 精度, 0.01
25, 柏レイソル, Home, Win, ずっと, 0.01
25, 柏レイソル, Home, Win, だろ, 0.01
25, 柏レイソル, Home, Win, 話し, 0.01
25, 柏レイソル, Home, Win, サイド, 0.009
25, 柏レイソル, Home, Win, ・, 0.009
26, 浦和レッズ, Home, Lose, メンタリティー, 0.022
26, 浦和レッズ, Home, Lose, 本当に, 0.014
26, 浦和レッズ, Home, Lose, 勝つ, 0.013
26, 浦和レッズ, Home, Lose, リスク, 0.013
26, 浦和レッズ, Home, Lose, コーナーキック, 0.011
26, 浦和レッズ, Home, Lose, ライン, 0.011
26, 浦和レッズ, Home, Lose, なけれ, 0.01
26, 浦和レッズ, Home, Lose, そういう, 0.009
26, 浦和レッズ, Home, Lose, シーン, 0.009
26, 浦和レッズ, Home, Lose, 切る, 0.009
27, ジュビロ磐田, Away, Win, ホーム, 0.051
27, ジュビロ磐田, Away, Win, 行い, 0.051
27, ジュビロ磐田, Away, Win, タフ, 0.051
27, ジュビロ磐田, Away, Win, 攻め込ま, 0.051
27, ジュビロ磐田, Away, Win, 奪え, 0.051
27, ジュビロ磐田, Away, Win, リアクション, 0.041
27, ジュビロ磐田, Away, Win, 同点, 0.035
27, ジュビロ磐田, Away, Win, 決勝, 0.031
27, ジュビロ磐田, Away, Win, 値する, 0.031
27, ジュビロ磐田, Away, Win, 入り, 0.031
28, ベガルタ仙台, Home, Win, ７, 0.018
28, ベガルタ仙台, Home, Win, ８, 0.018
28, ベガルタ仙台, Home, Win, けれど, 0.015
28, ベガルタ仙台, Home, Win, いつも, 0.014
28, ベガルタ仙台, Home, Win, 正直, 0.012
28, ベガルタ仙台, Home, Win, 最初, 0.012
28, ベガルタ仙台, Home, Win, スイッチ, 0.011
28, ベガルタ仙台, Home, Win, 入れ, 0.011
28, ベガルタ仙台, Home, Win, 素晴らしかっ, 0.011
28, ベガルタ仙台, Home, Win, 正確, 0.011
29, 北海道コンサドーレ札幌, Home, Win, 理解, 0.013
29, 北海道コンサドーレ札幌, Home, Win, 順位, 0.013
29, 北海道コンサドーレ札幌, Home, Win, 押し込ん, 0.012
29, 北海道コンサドーレ札幌, Home, Win, キックオフ, 0.012
29, 北海道コンサドーレ札幌, Home, Win, スペース, 0.012
29, 北海道コンサドーレ札幌, Home, Win, かなり, 0.011
29, 北海道コンサドーレ札幌, Home, Win, 正直, 0.01
29, 北海道コンサドーレ札幌, Home, Win, いけ, 0.01
29, 北海道コンサドーレ札幌, Home, Win, 上がっ, 0.01
29, 北海道コンサドーレ札幌, Home, Win, 連勝, 0.01
30, ガンバ大阪, Away, Lose, しまい, 0.046
30, ガンバ大阪, Away, Lose, ミス, 0.038
30, ガンバ大阪, Away, Lose, ほど, 0.032
30, ガンバ大阪, Away, Lose, つながっ, 0.032
30, ガンバ大阪, Away, Lose, 称え, 0.032
30, ガンバ大阪, Away, Lose, ず, 0.03
30, ガンバ大阪, Away, Lose, あきらめ, 0.029
30, ガンバ大阪, Away, Lose, やってき, 0.029
30, ガンバ大阪, Away, Lose, 権, 0.026
30, ガンバ大阪, Away, Lose, 主導, 0.026
31, FC東京, Home, Lose, 求める, 0.022
31, FC東京, Home, Lose, 発揮, 0.022
31, FC東京, Home, Lose, ピッチ, 0.018
31, FC東京, Home, Lose, 問題, 0.016
31, FC東京, Home, Lose, アン, 0.015
31, FC東京, Home, Lose, ラッキー, 0.013
31, FC東京, Home, Lose, コンディション, 0.013
31, FC東京, Home, Lose, れる, 0.013
31, FC東京, Home, Lose, 視点, 0.011
31, FC東京, Home, Lose, ゼロ, 0.011
32, Ｖ･ファーレン長崎, Away, Win, 悪く, 0.044
32, Ｖ･ファーレン長崎, Away, Win, 疲れ, 0.027
32, Ｖ･ファーレン長崎, Away, Win, 粘り強く, 0.027
32, Ｖ･ファーレン長崎, Away, Win, 決して, 0.027
32, Ｖ･ファーレン長崎, Away, Win, 入ら, 0.022
32, Ｖ･ファーレン長崎, Away, Win, 奪っ, 0.022
32, Ｖ･ファーレン長崎, Away, Win, Ｊ, 0.022
32, Ｖ･ファーレン長崎, Away, Win, 公式, 0.019
32, Ｖ･ファーレン長崎, Away, Win, つくっ, 0.019
32, Ｖ･ファーレン長崎, Away, Win, 連敗, 0.019
33, サガン鳥栖, Away, Lose, 意欲, 0.042
33, サガン鳥栖, Away, Lose, ファウル, 0.042
33, サガン鳥栖, Away, Lose, 思わ, 0.034
33, サガン鳥栖, Away, Lose, イーブン, 0.034
33, サガン鳥栖, Away, Lose, 来, 0.034
33, サガン鳥栖, Away, Lose, 取ら, 0.029
33, サガン鳥栖, Away, Lose, 流れ, 0.025
33, サガン鳥栖, Away, Lose, 強い, 0.025
33, サガン鳥栖, Away, Lose, ワーク, 0.023
33, サガン鳥栖, Away, Lose, ハード, 0.023
34, セレッソ大阪, Home, Lose, 対策, 0.016
34, セレッソ大阪, Home, Lose, シーズン, 0.013
34, セレッソ大阪, Home, Lose, うまく, 0.013
34, セレッソ大阪, Home, Lose, 出せ, 0.013
34, セレッソ大阪, Home, Lose, ・, 0.011
34, セレッソ大阪, Home, Lose, 帯, 0.009
34, セレッソ大阪, Home, Lose, 絶対, 0.008
34, セレッソ大阪, Home, Lose, 総括, 0.008
34, セレッソ大阪, Home, Lose, そんな, 0.008
34, セレッソ大阪, Home, Lose, 置く, 0.008
