Matchday#, Team_Against, Home_Away, Match_Result, Word, TF-IDF
01, ガンバ大阪, Home, Lose, スタート, 0.028
01, ガンバ大阪, Home, Lose, 責任, 0.027
01, ガンバ大阪, Home, Lose, しまう, 0.022
01, ガンバ大阪, Home, Lose, 難しく, 0.02
01, ガンバ大阪, Home, Lose, つくれ, 0.019
01, ガンバ大阪, Home, Lose, なら, 0.018
01, ガンバ大阪, Home, Lose, 行っ, 0.016
01, ガンバ大阪, Home, Lose, 状況, 0.014
01, ガンバ大阪, Home, Lose, 良かっ, 0.014
01, ガンバ大阪, Home, Lose, なり, 0.013
02, 浦和レッズ, Away, Draw, 公式, 0.057
02, 浦和レッズ, Away, Draw, リズム, 0.046
02, 浦和レッズ, Away, Draw, テンポ, 0.046
02, 浦和レッズ, Away, Draw, 出る, 0.038
02, 浦和レッズ, Away, Draw, 練習, 0.031
02, 浦和レッズ, Away, Draw, 上げ, 0.026
02, 浦和レッズ, Away, Draw, 今後, 0.021
02, 浦和レッズ, Away, Draw, 離れ, 0.021
02, 浦和レッズ, Away, Draw, いこ, 0.021
02, 浦和レッズ, Away, Draw, スピード, 0.021
03, 湘南ベルマーレ, Home, Win, リーダーシップ, 0.036
03, 湘南ベルマーレ, Home, Win, くれる, 0.028
03, 湘南ベルマーレ, Home, Win, しよ, 0.024
03, 湘南ベルマーレ, Home, Win, キャプテン, 0.024
03, 湘南ベルマーレ, Home, Win, 声, 0.024
03, 湘南ベルマーレ, Home, Win, 力強, 0.024
03, 湘南ベルマーレ, Home, Win, 自粛, 0.024
03, 湘南ベルマーレ, Home, Win, コンビネーション, 0.019
03, 湘南ベルマーレ, Home, Win, シーズン, 0.017
03, 湘南ベルマーレ, Home, Win, 難しく, 0.016
04, FC東京, Home, Lose, 見れ, 0.029
04, FC東京, Home, Lose, 布陣, 0.025
04, FC東京, Home, Lose, 全体, 0.024
04, FC東京, Home, Lose, 皆, 0.022
04, FC東京, Home, Lose, ベンチ, 0.018
04, FC東京, Home, Lose, 焼い, 0.018
04, FC東京, Home, Lose, 組み, 0.018
04, FC東京, Home, Lose, 使い, 0.018
04, FC東京, Home, Lose, にくい, 0.018
04, FC東京, Home, Lose, 陣, 0.018
05, 鹿島アントラーズ, Away, Lose, ミス, 0.101
05, 鹿島アントラーズ, Away, Lose, 失点, 0.065
05, 鹿島アントラーズ, Away, Lose, 奪わ, 0.056
05, 鹿島アントラーズ, Away, Lose, なくさ, 0.056
05, 鹿島アントラーズ, Away, Lose, 多い, 0.051
05, 鹿島アントラーズ, Away, Lose, しまう, 0.046
05, 鹿島アントラーズ, Away, Lose, いけ, 0.043
05, 鹿島アントラーズ, Away, Lose, フィジカル, 0.042
05, 鹿島アントラーズ, Away, Lose, しまい, 0.038
05, 鹿島アントラーズ, Away, Lose, 縦, 0.035
06, 横浜FC, Home, Win, 仙頭, 0.04
06, 横浜FC, Home, Win, －, 0.03
06, 横浜FC, Home, Win, 横浜, 0.025
06, 横浜FC, Home, Win, アジャスト, 0.025
06, 横浜FC, Home, Win, システム, 0.022
06, 横浜FC, Home, Win, 皆さん, 0.02
06, 横浜FC, Home, Win, ＦＣ, 0.02
06, 横浜FC, Home, Win, 挑戦, 0.017
06, 横浜FC, Home, Win, 変更, 0.015
06, 横浜FC, Home, Win, ４, 0.014
07, 北海道コンサドーレ札幌, Away, Lose, ミス, 0.046
07, 北海道コンサドーレ札幌, Away, Lose, どうこう, 0.039
07, 北海道コンサドーレ札幌, Away, Lose, しまい, 0.035
07, 北海道コンサドーレ札幌, Away, Lose, 多かっ, 0.034
07, 北海道コンサドーレ札幌, Away, Lose, ダブルボランチ, 0.032
07, 北海道コンサドーレ札幌, Away, Lose, 狙う, 0.032
07, 北海道コンサドーレ札幌, Away, Lose, 取ろ, 0.032
07, 北海道コンサドーレ札幌, Away, Lose, 主力, 0.032
07, 北海道コンサドーレ札幌, Away, Lose, タテ, 0.032
07, 北海道コンサドーレ札幌, Away, Lose, 見返し, 0.032
08, ベガルタ仙台, Away, Win, パクイルギュ, 0.046
08, ベガルタ仙台, Away, Win, ケガ, 0.045
08, ベガルタ仙台, Away, Win, 仙頭, 0.036
08, ベガルタ仙台, Away, Win, ポジション, 0.031
08, ベガルタ仙台, Away, Win, ＣＢ, 0.031
08, ベガルタ仙台, Away, Win, レンタル, 0.023
08, ベガルタ仙台, Away, Win, 見せる, 0.023
08, ベガルタ仙台, Away, Win, 移籍, 0.023
08, ベガルタ仙台, Away, Win, 約束事, 0.023
08, ベガルタ仙台, Away, Win, 違う, 0.023
09, 柏レイソル, Home, Draw, 切る, 0.037
09, 柏レイソル, Home, Draw, 信じ, 0.033
09, 柏レイソル, Home, Draw, 出し切っ, 0.029
09, 柏レイソル, Home, Draw, 一人ひとり, 0.025
09, 柏レイソル, Home, Draw, くる, 0.024
09, 柏レイソル, Home, Draw, 決め, 0.021
09, 柏レイソル, Home, Draw, 今後, 0.02
09, 柏レイソル, Home, Draw, うる, 0.018
09, 柏レイソル, Home, Draw, 収穫, 0.018
09, 柏レイソル, Home, Draw, かい, 0.018
10, 大分トリニータ, Away, Lose, 前田, 0.062
10, 大分トリニータ, Away, Lose, 良く, 0.052
10, 大分トリニータ, Away, Lose, とっ, 0.052
10, 大分トリニータ, Away, Lose, 聞か, 0.052
10, 大分トリニータ, Away, Lose, 全体, 0.045
10, 大分トリニータ, Away, Lose, 評価, 0.041
10, 大分トリニータ, Away, Lose, 機能, 0.041
10, 大分トリニータ, Away, Lose, 具体, 0.041
10, 大分トリニータ, Away, Lose, 勝つ, 0.041
10, 大分トリニータ, Away, Lose, 責任, 0.035
11, 清水エスパルス, Away, Win, 彼ら, 0.029
11, 清水エスパルス, Away, Win, 戦力, 0.029
11, 清水エスパルス, Away, Win, クラモフスキー, 0.029
11, 清水エスパルス, Away, Win, 会え, 0.029
11, 清水エスパルス, Away, Win, 面白い, 0.029
11, 清水エスパルス, Away, Win, お互い, 0.023
11, 清水エスパルス, Away, Win, フィット, 0.023
11, 清水エスパルス, Away, Win, 仕事, 0.023
11, 清水エスパルス, Away, Win, いい, 0.022
11, 清水エスパルス, Away, Win, 久々, 0.02
12, サンフレッチェ広島, Home, Win, もたらし, 0.032
12, サンフレッチェ広島, Home, Win, サブ, 0.032
12, サンフレッチェ広島, Home, Win, ポジティブ, 0.029
12, サンフレッチェ広島, Home, Win, フィット, 0.026
12, サンフレッチェ広島, Home, Win, 発揮, 0.022
12, サンフレッチェ広島, Home, Win, 状況, 0.018
12, サンフレッチェ広島, Home, Win, 修正, 0.017
12, サンフレッチェ広島, Home, Win, 分間, 0.017
12, サンフレッチェ広島, Home, Win, 去年, 0.017
12, サンフレッチェ広島, Home, Win, 落ち, 0.016
13, 北海道コンサドーレ札幌, Home, Win, 完封, 0.039
13, 北海道コンサドーレ札幌, Home, Win, する, 0.023
13, 北海道コンサドーレ札幌, Home, Win, 個人, 0.02
13, 北海道コンサドーレ札幌, Home, Win, 意欲, 0.02
13, 北海道コンサドーレ札幌, Home, Win, 暑, 0.02
13, 北海道コンサドーレ札幌, Home, Win, 楽しい, 0.02
13, 北海道コンサドーレ札幌, Home, Win, いっさい, 0.02
13, 北海道コンサドーレ札幌, Home, Win, 褒美, 0.02
13, 北海道コンサドーレ札幌, Home, Win, 松田, 0.02
13, 北海道コンサドーレ札幌, Home, Win, 挙げ, 0.02
14, ヴィッセル神戸, Away, Draw, 集中, 0.061
14, ヴィッセル神戸, Away, Draw, 決定的, 0.042
14, ヴィッセル神戸, Away, Draw, 機, 0.042
14, ヴィッセル神戸, Away, Draw, 決定, 0.042
14, ヴィッセル神戸, Away, Draw, 保て, 0.042
14, ヴィッセル神戸, Away, Draw, 苦しく, 0.042
14, ヴィッセル神戸, Away, Draw, 苦しい, 0.042
14, ヴィッセル神戸, Away, Draw, 逃し, 0.042
14, ヴィッセル神戸, Away, Draw, 苦しめる, 0.042
14, ヴィッセル神戸, Away, Draw, 引き分け, 0.042
15, 川崎フロンターレ, Home, Lose, 振り返っ, 0.063
15, 川崎フロンターレ, Home, Lose, 続き, 0.042
15, 川崎フロンターレ, Home, Lose, 明日, 0.042
15, 川崎フロンターレ, Home, Lose, 展開, 0.035
15, 川崎フロンターレ, Home, Lose, 後半, 0.03
15, 川崎フロンターレ, Home, Lose, 点差, 0.026
15, 川崎フロンターレ, Home, Lose, 情報, 0.026
15, 川崎フロンターレ, Home, Lose, 耳, 0.026
15, 川崎フロンターレ, Home, Lose, 数字, 0.026
15, 川崎フロンターレ, Home, Lose, おい, 0.026
16, 名古屋グランパス, Away, Lose, ミス, 0.038
16, 名古屋グランパス, Away, Lose, 逆転, 0.036
16, 名古屋グランパス, Away, Lose, 変え, 0.035
16, 名古屋グランパス, Away, Lose, しまう, 0.035
16, 名古屋グランパス, Away, Lose, システム, 0.032
16, 名古屋グランパス, Away, Lose, 結びつか, 0.026
16, 名古屋グランパス, Away, Lose, 追いつか, 0.026
16, 名古屋グランパス, Away, Lose, 途中, 0.026
16, 名古屋グランパス, Away, Lose, 戻し, 0.026
16, 名古屋グランパス, Away, Lose, 敗戦, 0.026
17, セレッソ大阪, Home, Lose, ボックス, 0.037
17, セレッソ大阪, Home, Lose, 取らせ, 0.036
17, セレッソ大阪, Home, Lose, おっしゃる, 0.036
17, セレッソ大阪, Home, Lose, 原則, 0.036
17, セレッソ大阪, Home, Lose, ポスト, 0.036
17, セレッソ大阪, Home, Lose, 取る, 0.029
17, セレッソ大阪, Home, Lose, 質, 0.025
17, セレッソ大阪, Home, Lose, 行き, 0.025
17, セレッソ大阪, Home, Lose, 最後, 0.022
17, セレッソ大阪, Home, Lose, 悔しい, 0.022
18, 清水エスパルス, Home, Win, ポジション, 0.041
18, 清水エスパルス, Home, Win, 畠中, 0.03
18, 清水エスパルス, Home, Win, システム, 0.03
18, 清水エスパルス, Home, Win, 喜田, 0.027
18, 清水エスパルス, Home, Win, 守る, 0.02
18, 清水エスパルス, Home, Win, 詳しい, 0.02
18, 清水エスパルス, Home, Win, 経験, 0.016
18, 清水エスパルス, Home, Win, 仕事, 0.016
18, 清水エスパルス, Home, Win, 状態, 0.014
18, 清水エスパルス, Home, Win, ベスト, 0.014
19, サガン鳥栖, Away, Win, 率, 0.05
19, サガン鳥栖, Away, Win, 前半, 0.033
19, サガン鳥栖, Away, Win, ボール, 0.027
19, サガン鳥栖, Away, Win, 場面, 0.027
19, サガン鳥栖, Away, Win, 狙える, 0.025
19, サガン鳥栖, Away, Win, 上回ら, 0.025
19, サガン鳥栖, Away, Win, 回し, 0.025
19, サガン鳥栖, Away, Win, 自陣, 0.025
19, サガン鳥栖, Away, Win, つなが, 0.025
19, サガン鳥栖, Away, Win, 和田, 0.025
20, ベガルタ仙台, Home, Win, 連動, 0.041
20, ベガルタ仙台, Home, Win, 伝え, 0.037
20, ベガルタ仙台, Home, Win, 結びつい, 0.034
20, ベガルタ仙台, Home, Win, 努力, 0.028
20, ベガルタ仙台, Home, Win, プレス, 0.023
20, ベガルタ仙台, Home, Win, 全員, 0.021
20, ベガルタ仙台, Home, Win, 後ろ, 0.021
20, ベガルタ仙台, Home, Win, コンディション, 0.021
20, ベガルタ仙台, Home, Win, ジュニオールサントス, 0.021
20, ベガルタ仙台, Home, Win, 姿勢, 0.021
21, 柏レイソル, Away, Win, 方向, 0.04
21, 柏レイソル, Away, Win, 行こ, 0.032
21, 柏レイソル, Away, Win, 逆転, 0.028
21, 柏レイソル, Away, Win, メンタリティー, 0.027
21, 柏レイソル, Away, Win, 最後, 0.025
21, 柏レイソル, Away, Win, アグレッシブ, 0.02
21, 柏レイソル, Away, Win, 聞い, 0.018
21, 柏レイソル, Away, Win, 意図, 0.018
21, 柏レイソル, Away, Win, 水曜日, 0.018
21, 柏レイソル, Away, Win, 素晴らしい, 0.018
22, サガン鳥栖, Home, Draw, シンプル, 0.071
22, サガン鳥栖, Home, Draw, おっしゃい, 0.036
22, サガン鳥栖, Home, Draw, 響い, 0.036
22, サガン鳥栖, Home, Draw, 不満, 0.036
22, サガン鳥栖, Home, Draw, プラン, 0.036
22, サガン鳥栖, Home, Draw, 勝ち負け, 0.036
22, サガン鳥栖, Home, Draw, 抜き, 0.036
22, サガン鳥栖, Home, Draw, ９, 0.035
22, サガン鳥栖, Home, Draw, 見え, 0.031
22, サガン鳥栖, Home, Draw, 変わり, 0.029
23, ヴィッセル神戸, Home, Lose, ポジション, 0.031
23, ヴィッセル神戸, Home, Lose, 最高, 0.031
23, ヴィッセル神戸, Home, Lose, そろっ, 0.024
23, ヴィッセル神戸, Home, Lose, パフォーマンス, 0.023
23, ヴィッセル神戸, Home, Lose, 内容, 0.023
23, ヴィッセル神戸, Home, Lose, ＣＢ, 0.021
23, ヴィッセル神戸, Home, Lose, 久々, 0.021
23, ヴィッセル神戸, Home, Lose, 扇原, 0.018
23, ヴィッセル神戸, Home, Lose, 皆さん, 0.016
23, ヴィッセル神戸, Home, Lose, 始まれ, 0.015
24, 大分トリニータ, Home, Win, 素晴らしい, 0.069
24, 大分トリニータ, Home, Win, ロング, 0.052
24, 大分トリニータ, Home, Win, 喜田, 0.028
24, 大分トリニータ, Home, Win, 角田, 0.026
24, 大分トリニータ, Home, Win, 梶川, 0.026
24, 大分トリニータ, Home, Win, 味わわ, 0.026
24, 大分トリニータ, Home, Win, 先日, 0.026
24, 大分トリニータ, Home, Win, 拾っ, 0.026
24, 大分トリニータ, Home, Win, 予定, 0.026
24, 大分トリニータ, Home, Win, 読ん, 0.026
25, ガンバ大阪, Away, Draw, 拾え, 0.071
25, ガンバ大阪, Away, Draw, 代える, 0.047
25, ガンバ大阪, Away, Draw, セカンド, 0.047
25, ガンバ大阪, Away, Draw, 最後, 0.044
25, ガンバ大阪, Away, Draw, キープ, 0.032
25, ガンバ大阪, Away, Draw, 繰り広げ, 0.028
25, ガンバ大阪, Away, Draw, み, 0.024
25, ガンバ大阪, Away, Draw, フォワード, 0.024
25, ガンバ大阪, Away, Draw, 出し切る, 0.024
25, ガンバ大阪, Away, Draw, 人数, 0.024
26, セレッソ大阪, Away, Lose, スケジュール, 0.059
26, セレッソ大阪, Away, Lose, 強度, 0.033
26, セレッソ大阪, Away, Lose, 高い, 0.033
26, セレッソ大阪, Away, Lose, 最後, 0.03
26, セレッソ大阪, Away, Lose, どうこう, 0.029
26, セレッソ大阪, Away, Lose, システム, 0.029
26, セレッソ大阪, Away, Lose, 毎回, 0.024
26, セレッソ大阪, Away, Lose, さっき, 0.024
26, セレッソ大阪, Away, Lose, 疲労, 0.024
26, セレッソ大阪, Away, Lose, とらえ, 0.024
27, 名古屋グランパス, Home, Win, 素晴らしい, 0.044
27, 名古屋グランパス, Home, Win, ボックス, 0.041
27, 名古屋グランパス, Home, Win, 天野, 0.04
27, 名古屋グランパス, Home, Win, 質, 0.028
27, 名古屋グランパス, Home, Win, 上げ, 0.028
27, 名古屋グランパス, Home, Win, 全体, 0.027
27, 名古屋グランパス, Home, Win, 前節, 0.022
27, 名古屋グランパス, Home, Win, 表わせ, 0.02
27, 名古屋グランパス, Home, Win, メーク, 0.02
27, 名古屋グランパス, Home, Win, 切れる, 0.02
28, FC東京, Away, Win, ＦＣ, 0.033
28, FC東京, Away, Win, 消化, 0.028
28, FC東京, Away, Win, 週間, 0.028
28, FC東京, Away, Win, スコア, 0.028
28, FC東京, Away, Win, 空い, 0.028
28, FC東京, Away, Win, 信じ, 0.025
28, FC東京, Away, Win, 成長, 0.022
28, FC東京, Away, Win, 多い, 0.02
28, FC東京, Away, Win, あきらめ, 0.019
28, FC東京, Away, Win, つながっ, 0.017
29, サンフレッチェ広島, Away, Lose, 最後, 0.044
29, サンフレッチェ広島, Away, Lose, ラッキー, 0.029
29, サンフレッチェ広島, Away, Lose, 受け止める, 0.029
29, サンフレッチェ広島, Away, Lose, 普通, 0.029
29, サンフレッチェ広島, Away, Lose, 高丘, 0.029
29, サンフレッチェ広島, Away, Lose, 受け止め, 0.029
29, サンフレッチェ広島, Away, Lose, ほしく, 0.029
29, サンフレッチェ広島, Away, Lose, 基づい, 0.029
29, サンフレッチェ広島, Away, Lose, 起き, 0.029
29, サンフレッチェ広島, Away, Lose, 哲学, 0.029
30, 鹿島アントラーズ, Home, Lose, プレッシャー, 0.05
30, 鹿島アントラーズ, Home, Lose, 後半, 0.041
30, 鹿島アントラーズ, Home, Lose, コントロール, 0.035
30, 鹿島アントラーズ, Home, Lose, 原因, 0.028
30, 鹿島アントラーズ, Home, Lose, ９月, 0.021
30, 鹿島アントラーズ, Home, Lose, 弱, 0.021
30, 鹿島アントラーズ, Home, Lose, デュエル, 0.021
30, 鹿島アントラーズ, Home, Lose, 勢い, 0.021
30, 鹿島アントラーズ, Home, Lose, 勝っ, 0.021
30, 鹿島アントラーズ, Home, Lose, 圧力, 0.021
31, 湘南ベルマーレ, Away, Lose, 最終, 0.053
31, 湘南ベルマーレ, Away, Lose, スペース, 0.046
31, 湘南ベルマーレ, Away, Lose, しまい, 0.044
31, 湘南ベルマーレ, Away, Lose, 終わっ, 0.036
31, 湘南ベルマーレ, Away, Lose, 先手, 0.033
31, 湘南ベルマーレ, Away, Lose, 揺らす, 0.033
31, 湘南ベルマーレ, Away, Lose, 狭く, 0.033
31, 湘南ベルマーレ, Away, Lose, 始まら, 0.033
31, 湘南ベルマーレ, Away, Lose, 小さく, 0.033
31, 湘南ベルマーレ, Away, Lose, 今夜, 0.033
32, 浦和レッズ, Home, Win, ＡＣＬ, 0.053
32, 浦和レッズ, Home, Win, 理解, 0.032
32, 浦和レッズ, Home, Win, フレッシュ, 0.026
32, 浦和レッズ, Home, Win, ラスト, 0.019
32, 浦和レッズ, Home, Win, アシスト, 0.019
32, 浦和レッズ, Home, Win, オナイウ, 0.019
32, 浦和レッズ, Home, Win, 水沼, 0.019
32, 浦和レッズ, Home, Win, ホーム, 0.019
32, 浦和レッズ, Home, Win, 簡単, 0.015
32, 浦和レッズ, Home, Win, 練習, 0.015
